{
  "schema": "vibeic.ppa.metric.v1",
  "metric": "area.design_report.um2",
  "status": "MEASURED",
  "unit": "um^2",
  "scope": {
    "stage": "post_route",
    "tool": "openroad",
    "fill": "post_fill"
  },
  "source": {
    "path": "/home/reyerchu/_jxlayer/run/trials/z03/phase3/stage3/pnr/openroad.log",
    "sha256": "sha256:e2ef82a6595892bc68021b511374fe83ca30fe86b449cad3d0a182de3a1cbe6c",
    "tool": "openroad",
    "tool_commit": "26Q3-1535-g543c33894f",
    "parser": "_ppa/backends/openroad.py",
    "parser_sha256": "sha256:6be03b7ad2a67293cab6ff7713718851be99e14b9b61668932801bb235e33a34",
    "occurrences": 1,
    "selection": "last"
  },
  "value": 6618.0
}
